{
  "$ref": "#/definitions/coordinators",
  "definitions": {
    "coordinators": {
      "type": "object",
      "properties": {
        "name": {
          "type": "string"
        },
        "isActive": {
          "type": "boolean"
        },
        "grade": {
          "type": "string"
        },
        "image": {
          "type": "string"
        },
        "hover_image": {
          "type": "string"
        },
        "study": {
          "type": "string"
        },
        "personalLink": {
          "type": "string"
        },
        "github": {
          "type": "string"
        },
        "linkedIn": {
          "type": "string"
        },
        "bio": {
          "type": "string"
        },
        "$schema": {
          "type": "string"
        }
      },
      "required": [
        "name",
        "isActive",
        "grade",
        "image"
      ],
      "additionalProperties": false
    }
  },
  "$schema": "http://json-schema.org/draft-07/schema#"
}