{
  "name": "Pranav Dronavalli",
  "isActive": true,
  "grade": "Junior",
  "study": "CS/Math",
  "github": "dronavallipranav",
  "personalLink": "https://www.dronavalli.dev/",
  "linkedIn": "pranavdronavalli",
  "image": "pranav-dronavalli-sad.jpg",
  "hover_image": "pranav-dronavalli-happy.jpg",
  "bio": "I like insects, not bugs"
}
