{
  "name": "Michael Gira",
  "isActive": false,
  "grade": "Super Senior",
  "study": "CS & Entrepreneurship",
  "personalLink": "https://gira.dev",
  "github": "michaelgira23",
  "linkedIn": "michael-gira",
  "bio": "Ever since I was a little kid I've been deathly afraid of limes. For my birthday, my mother served me key lime pie and I vigorously threw up on my great grandpa. I have not communicated with him since.",
  "image": "michael-gira.jpg"
}
