{
  "name": "David Teather",
  "isActive": false,
  "grade": "Senior",
  "image": "david-teather.png",
  "study": "CS & Entrepreneurship",
  "personalLink": "https://dteather.com/",
  "github": "davidteather",
  "linkedIn": "davidteather/",
  "bio": "Interested in web scraping and content design."
}